images/a01-000u-00.png	A MOVE to stop Mr. Gaitskell from
images/a01-000u-01.png	nominating any more Labour life Peers
images/a01-000u-02.png	is to be made at a meeting of Labour
images/a01-000u-04.png	put down a resolution on the subject
images/a01-000u-06.png	Griffiths, M P for Manchester Exchange.
images/a01-000x-00.png	A MOVE to stop Mr. Gaitskell from nominating
images/a01-000x-01.png	any more Labour life Peers is to be made at a
images/a01-000x-02.png	meeting of Labour 0M Ps tomorrow. Mr. Michael
